[
  {
    "id": "claude-opus-5",
    "name": "Claude Opus 5",
    "provider": "Anthropic",
    "type": "Propietario",
    "releaseDate": "2026-08-27",
    "context": 2000000,
    "modalities": [
      "Multimodal"
    ],
    "atlasScore": 99.2,
    "benchmarks": {
      "MMLU": 98.6,
      "GPQA": 94.8,
      "AIME": 99.1,
      "SWE-bench": 91.4
    },
    "officialUrl": "https://www.anthropic.com/",
    "apiUrl": "https://docs.anthropic.com/"
  },
  {
    "id": "claude-fable-5",
    "name": "Claude Fable 5",
    "provider": "Anthropic",
    "type": "Propietario",
    "releaseDate": "2026-08-24",
    "context": 1000000,
    "modalities": [
      "Multimodal"
    ],
    "atlasScore": 98.7,
    "benchmarks": {
      "MMLU": 97.8,
      "GPQA": 93.4,
      "AIME": 98.6,
      "SWE-bench": 88.2
    },
    "officialUrl": "https://www.anthropic.com/",
    "apiUrl": "https://docs.anthropic.com/"
  },
  {
    "id": "claude-mythos",
    "name": "Claude Mythos",
    "provider": "Anthropic",
    "type": "Propietario",
    "releaseDate": "2026-08-10",
    "context": 1000000,
    "modalities": [
      "Multimodal"
    ],
    "atlasScore": 97.9,
    "benchmarks": {
      "MMLU": 96.9,
      "GPQA": 92.1,
      "AIME": 97.5,
      "SWE-bench": 85.9
    },
    "officialUrl": "https://www.anthropic.com/",
    "apiUrl": "https://docs.anthropic.com/"
  },
  {
    "id": "claude-opus-4-1",
    "name": "Claude Opus 4.1",
    "provider": "Anthropic",
    "type": "Propietario",
    "releaseDate": "2025-08-05",
    "context": 200000,
    "modalities": [
      "Multimodal"
    ],
    "atlasScore": 93.7,
    "benchmarks": {
      "MMLU": 92,
      "GPQA": 87,
      "AIME": 93,
      "SWE-bench": 74.5
    },
    "officialUrl": "https://www.anthropic.com/",
    "apiUrl": "https://docs.anthropic.com/"
  },
  {
    "id": "claude-3-7-sonnet",
    "name": "Claude 3.7 Sonnet",
    "provider": "Anthropic",
    "type": "Propietario",
    "releaseDate": "2025-02-24",
    "context": 200000,
    "modalities": [
      "Multimodal"
    ],
    "atlasScore": 94.6,
    "benchmarks": {
      "MMLU": 92.2,
      "GPQA": 86.8,
      "AIME": 96.2,
      "SWE-bench": 77.8
    },
    "officialUrl": "https://www.anthropic.com/",
    "apiUrl": "https://docs.anthropic.com/"
  },
  {
    "id": "claude-3-5-sonnet",
    "name": "Claude 3.5 Sonnet (v2)",
    "provider": "Anthropic",
    "type": "Propietario",
    "releaseDate": "2024-10-22",
    "context": 200000,
    "modalities": [
      "Multimodal"
    ],
    "atlasScore": 92.4,
    "benchmarks": {
      "MMLU": 90.4,
      "GPQA": 75.3,
      "AIME": 82,
      "SWE-bench": 64.9
    },
    "officialUrl": "https://www.anthropic.com/",
    "apiUrl": "https://docs.anthropic.com/"
  },
  {
    "id": "claude-3-5-haiku",
    "name": "Claude 3.5 Haiku",
    "provider": "Anthropic",
    "type": "Propietario",
    "releaseDate": "2024-11-04",
    "context": 200000,
    "modalities": [
      "Text"
    ],
    "atlasScore": 88.5,
    "benchmarks": {
      "MMLU": 86.4,
      "GPQA": 69.2,
      "AIME": 74,
      "SWE-bench": 51.6
    },
    "officialUrl": "https://www.anthropic.com/",
    "apiUrl": "https://docs.anthropic.com/"
  },
  {
    "id": "gpt-5-6-luna",
    "name": "GPT-5.6 Luna",
    "provider": "OpenAI",
    "type": "Propietario",
    "releaseDate": "2026-08-25",
    "context": 2000000,
    "modalities": [
      "Multimodal"
    ],
    "atlasScore": 98.8,
    "benchmarks": {
      "MMLU": 97.9,
      "GPQA": 93.6,
      "AIME": 98.9,
      "SWE-bench": 87.8
    },
    "officialUrl": "https://openai.com/",
    "apiUrl": "https://platform.openai.com/docs/"
  },
  {
    "id": "gpt-sol",
    "name": "GPT Sol",
    "provider": "OpenAI",
    "type": "Propietario",
    "releaseDate": "2026-08-20",
    "context": 1000000,
    "modalities": [
      "Multimodal"
    ],
    "atlasScore": 98.4,
    "benchmarks": {
      "MMLU": 97.2,
      "GPQA": 92.6,
      "AIME": 98.4,
      "SWE-bench": 86.5
    },
    "officialUrl": "https://openai.com/",
    "apiUrl": "https://platform.openai.com/docs/"
  },
  {
    "id": "gpt-5",
    "name": "GPT-5",
    "provider": "OpenAI",
    "type": "Propietario",
    "releaseDate": "2026-08-07",
    "context": 400000,
    "modalities": [
      "Multimodal"
    ],
    "atlasScore": 95.2,
    "benchmarks": {
      "MMLU": 93.8,
      "GPQA": 88.7,
      "AIME": 95.1,
      "SWE-bench": 79.4
    },
    "officialUrl": "https://openai.com/",
    "apiUrl": "https://platform.openai.com/docs/"
  },
  {
    "id": "o3",
    "name": "OpenAI o3",
    "provider": "OpenAI",
    "type": "Propietario",
    "releaseDate": "2025-05-14",
    "context": 200000,
    "modalities": [
      "Multimodal"
    ],
    "atlasScore": 94.8,
    "benchmarks": {
      "MMLU": 92.5,
      "GPQA": 87.7,
      "AIME": 96.7,
      "SWE-bench": 78.2
    },
    "officialUrl": "https://openai.com/",
    "apiUrl": "https://platform.openai.com/docs/"
  },
  {
    "id": "gpt-4-5",
    "name": "GPT-4.5",
    "provider": "OpenAI",
    "type": "Propietario",
    "releaseDate": "2025-02-27",
    "context": 128000,
    "modalities": [
      "Multimodal"
    ],
    "atlasScore": 93.5,
    "benchmarks": {
      "MMLU": 91.8,
      "GPQA": 84.5,
      "AIME": 88.2,
      "SWE-bench": 71.3
    },
    "officialUrl": "https://openai.com/",
    "apiUrl": "https://platform.openai.com/docs/"
  },
  {
    "id": "o3-mini",
    "name": "OpenAI o3-mini",
    "provider": "OpenAI",
    "type": "Propietario",
    "releaseDate": "2025-01-31",
    "context": 200000,
    "modalities": [
      "Text"
    ],
    "atlasScore": 92.1,
    "benchmarks": {
      "MMLU": 89.4,
      "GPQA": 83.2,
      "AIME": 94,
      "SWE-bench": 72.8
    },
    "officialUrl": "https://openai.com/",
    "apiUrl": "https://platform.openai.com/docs/"
  },
  {
    "id": "o1",
    "name": "OpenAI o1",
    "provider": "OpenAI",
    "type": "Propietario",
    "releaseDate": "2024-12-05",
    "context": 200000,
    "modalities": [
      "Multimodal"
    ],
    "atlasScore": 92.7,
    "benchmarks": {
      "MMLU": 91.8,
      "GPQA": 78,
      "AIME": 83.3,
      "SWE-bench": 67.2
    },
    "officialUrl": "https://openai.com/",
    "apiUrl": "https://platform.openai.com/docs/"
  },
  {
    "id": "gpt-4o",
    "name": "GPT-4o",
    "provider": "OpenAI",
    "type": "Propietario",
    "releaseDate": "2024-05-13",
    "context": 128000,
    "modalities": [
      "Multimodal"
    ],
    "atlasScore": 90.5,
    "benchmarks": {
      "MMLU": 88.7,
      "GPQA": 74.2,
      "AIME": 76.6,
      "SWE-bench": 53.7
    },
    "officialUrl": "https://openai.com/",
    "apiUrl": "https://platform.openai.com/docs/"
  },
  {
    "id": "gemini-3-5-flash-lite",
    "name": "Gemini 3.5 Flash-Lite",
    "provider": "Google",
    "type": "Propietario",
    "releaseDate": "2026-08-29",
    "context": 2000000,
    "modalities": [
      "Multimodal"
    ],
    "atlasScore": 97.4,
    "benchmarks": {
      "MMLU": 96.5,
      "GPQA": 90.8,
      "AIME": 96.2,
      "SWE-bench": 83.4
    },
    "officialUrl": "https://deepmind.google/technologies/gemini/",
    "apiUrl": "https://ai.google.dev/"
  },
  {
    "id": "google-flash-7",
    "name": "Google Flash 7",
    "provider": "Google",
    "type": "Propietario",
    "releaseDate": "2026-08-28",
    "context": 3000000,
    "modalities": [
      "Multimodal"
    ],
    "atlasScore": 97.8,
    "benchmarks": {
      "MMLU": 96.8,
      "GPQA": 91.8,
      "AIME": 97.2,
      "SWE-bench": 85
    },
    "officialUrl": "https://deepmind.google/technologies/gemini/",
    "apiUrl": "https://ai.google.dev/"
  },
  {
    "id": "gemini-3-0-ultra",
    "name": "Gemini 3.0 Ultra",
    "provider": "Google",
    "type": "Propietario",
    "releaseDate": "2026-08-12",
    "context": 4000000,
    "modalities": [
      "Multimodal"
    ],
    "atlasScore": 98.1,
    "benchmarks": {
      "MMLU": 97.5,
      "GPQA": 92.7,
      "AIME": 98,
      "SWE-bench": 86.2
    },
    "officialUrl": "https://deepmind.google/technologies/gemini/",
    "apiUrl": "https://ai.google.dev/"
  },
  {
    "id": "gemini-2-5-flash-lite",
    "name": "Gemini 2.5 Flash-Lite",
    "provider": "Google",
    "type": "Propietario",
    "releaseDate": "2025-06-18",
    "context": 1000000,
    "modalities": [
      "Multimodal"
    ],
    "atlasScore": 93.8,
    "benchmarks": {
      "MMLU": 91.8,
      "GPQA": 84.6,
      "AIME": 92.4,
      "SWE-bench": 74
    },
    "officialUrl": "https://deepmind.google/technologies/gemini/",
    "apiUrl": "https://ai.google.dev/"
  },
  {
    "id": "gemini-2-5-pro",
    "name": "Gemini 2.5 Pro",
    "provider": "Google",
    "type": "Propietario",
    "releaseDate": "2025-03-25",
    "context": 1000000,
    "modalities": [
      "Multimodal"
    ],
    "atlasScore": 94.1,
    "benchmarks": {
      "MMLU": 92.4,
      "GPQA": 88.5,
      "AIME": 94.5,
      "SWE-bench": 76
    },
    "officialUrl": "https://deepmind.google/technologies/gemini/",
    "apiUrl": "https://ai.google.dev/"
  },
  {
    "id": "gemini-2-0-pro",
    "name": "Gemini 2.0 Pro",
    "provider": "Google",
    "type": "Propietario",
    "releaseDate": "2025-02-05",
    "context": 2000000,
    "modalities": [
      "Multimodal"
    ],
    "atlasScore": 93.4,
    "benchmarks": {
      "MMLU": 91.5,
      "GPQA": 85.2,
      "AIME": 91.8,
      "SWE-bench": 73.5
    },
    "officialUrl": "https://deepmind.google/technologies/gemini/",
    "apiUrl": "https://ai.google.dev/"
  },
  {
    "id": "gemini-2-0-flash",
    "name": "Gemini 2.0 Flash",
    "provider": "Google",
    "type": "Propietario",
    "releaseDate": "2025-01-22",
    "context": 1000000,
    "modalities": [
      "Multimodal"
    ],
    "atlasScore": 91.2,
    "benchmarks": {
      "MMLU": 88.9,
      "GPQA": 77.4,
      "AIME": 82.5,
      "SWE-bench": 61.2
    },
    "officialUrl": "https://deepmind.google/technologies/gemini/",
    "apiUrl": "https://ai.google.dev/"
  },
  {
    "id": "deepseek-r2",
    "name": "DeepSeek-R2",